<?xml version="1.0" encoding="utf-8"?>
<?xml-stylesheet type="text/xsl" href="HW7_Step4.xsl"?>
<catalog>
	<car>
		<make>Toyota</make>
		<model>Tacoma</model>
		<year>2020</year>
		<color>Grey</color>
		<engine>
			<cylinders>6</cylinders>
			<fuel_system>Fuel Injected</fuel_system>
		</engine>
		<number_of_doors>4</number_of_doors>
		<transmission_type>Automatic</transmission_type>
		<accessories radio="yes" air_conditioning="yes" power_windows="yes" power_steering="yes" power_brakes="yes"/>
	</car>
</catalog>

<!-- Victor Nguyen (nguye481) Step 4 -->
<!-- Document invalid if no attributes catalog tag but xslt works-->
<!-- xmlns="HW7" xmlns:xsi="http://www.w3.org/2001/XMLSchema-instance" xsi:schemaLocation="HW7.xsd" makes document valid but xslt does not work -->
